{
  "$schema": "https://json-schema.org/draft/2020-12/schema",
  "$id": "https://github.com/hellnbak/AgentSim/schemas/campaign-pack.schema.json",
  "title": "AgentSim Campaign Pack",
  "type": "object",
  "additionalProperties": false,
  "required": ["schema_version", "kind", "pack_id", "campaigns"],
  "properties": {
    "schema_version": {"const": "1.0"},
    "kind": {"const": "campaign-pack"},
    "pack_id": {"type": "string", "minLength": 3},
    "integrity": {
      "type": "object",
      "additionalProperties": false,
      "required": ["algorithm", "digest"],
      "properties": {"algorithm": {"const": "sha256"}, "digest": {"type": "string", "pattern": "^[a-f0-9]{64}$"}}
    },
    "campaigns": {
      "type": "array",
      "minItems": 1,
      "items": {
        "type": "object",
        "additionalProperties": false,
        "required": ["id", "name", "description", "objective", "target_profile", "authorization_required", "steps", "required_telemetry", "stop_conditions"],
        "properties": {
          "id": {"type": "string", "pattern": "^[a-z0-9][a-z0-9_.-]{2,127}$"},
          "name": {"type": "string", "minLength": 1},
          "description": {"type": "string", "minLength": 1},
          "objective": {"type": "string", "minLength": 1},
          "target_profile": {"type": "string", "minLength": 1},
          "authorization_required": {"const": true},
          "steps": {
            "type": "array",
            "minItems": 1,
            "items": {
              "type": "object",
              "additionalProperties": false,
              "required": ["id", "ability_id", "depends_on", "on_failure"],
              "properties": {
                "id": {"type": "string", "minLength": 1},
                "ability_id": {"type": "string", "minLength": 3},
                "depends_on": {"type": "array", "items": {"type": "string", "minLength": 1}},
                "on_failure": {"enum": ["stop", "continue"]}
              }
            }
          },
          "required_telemetry": {"type": "array", "items": {"type": "string", "minLength": 1}},
          "stop_conditions": {"type": "array", "minItems": 1, "items": {"type": "string", "minLength": 1}},
          "metadata": {"type": "object"}
        }
      }
    }
  }
}
